{
  "$schema": "https://json-schema.org/draft/2020-12/schema",
  "$id": "document.schema.json",
  "type": "object",
  "required": [
    "document_id",
    "asset_id",
    "title",
    "document_type",
    "source_ref"
  ],
  "properties": {
    "document_id": {
      "type": "string",
      "minLength": 1
    },
    "asset_id": {
      "type": "string",
      "minLength": 1
    },
    "title": {
      "type": "string",
      "minLength": 1
    },
    "document_type": {
      "type": "string",
      "minLength": 1
    },
    "source_ref": {
      "type": "string",
      "minLength": 1
    }
  },
  "additionalProperties": false
}
